{
  "example_only": true,
  "nickname": "Example nickname",
  "school": "Example University",
  "stage": "third-year undergraduate",
  "direction": "example direction (e.g. computer science / data engineering)",
  "weekly_time": "10 hours a week, mostly weekday evenings",
  "goals": [
    "Example goal 1: complete one full loop through the first course inside this group",
    "Example goal 2: establish a sustainable weekly study rhythm"
  ],
  "tutoring_preference": "map first, then one branch at a time; confirm after each step before continuing",
  "long_explanation_mode": "map-first",
  "branch_confirmation": "stop and confirm after each branch; do not run several together",
  "cycle_structure": "3-1-3 (block A input, a rest day, block B integration)",
  "small_adjustment": "twice per cycle, at most one runtime parameter each",
  "big_adjustment": "one adjustment window every three cycles",
  "aged_review_mode": "suggest",
  "existing_basis": "example prior background; write \"none\" honestly if there is none",
  "current_difficulty": "not provided",
  "teaching_notes": "example teaching notes; write \"not provided\" if there are none",
  "exercise_hint_gate": "enabled",
  "learning_timezone": "America/New_York",
  "learning_day_cutoff": "04:00",
  "lesson_actual_review": "on",
  "lesson_student_feedback": "on",
  "lesson_knowledge_absorption": "on",
  "exercise_problem_review": "on",
  "exercise_knowledge_mastery": "on",
  "updated": "2026-01-01"
}
